[
  {
    "id": "jma-130020-14",
    "type": "warning",
    "severity": "warning",
    "time": "2026-05-28T10:16:00+09:00",
    "lat": null,
    "lon": null,
    "title": "Thunderstorm Advisory (継続) — Tokyo area",
    "titleJa": "雷注意報（継続）",
    "affects": [],
    "source": "jma",
    "url": "https://www.jma.go.jp/bosai/warning/#area_type=class20s&area_code=130000",
    "magnitude": null,
    "maxScale": null
  },
  {
    "id": "jma-130020-20",
    "type": "warning",
    "severity": "warning",
    "time": "2026-05-28T10:16:00+09:00",
    "lat": null,
    "lon": null,
    "title": "Dry Air Advisory (継続) — Tokyo area",
    "titleJa": "乾燥注意報（継続）",
    "affects": [],
    "source": "jma",
    "url": "https://www.jma.go.jp/bosai/warning/#area_type=class20s&area_code=130000",
    "magnitude": null,
    "maxScale": null
  },
  {
    "id": "jma-130030-14",
    "type": "warning",
    "severity": "warning",
    "time": "2026-05-28T10:16:00+09:00",
    "lat": null,
    "lon": null,
    "title": "Thunderstorm Advisory (継続) — Tokyo area",
    "titleJa": "雷注意報（継続）",
    "affects": [],
    "source": "jma",
    "url": "https://www.jma.go.jp/bosai/warning/#area_type=class20s&area_code=130000",
    "magnitude": null,
    "maxScale": null
  },
  {
    "id": "jma-130030-15",
    "type": "warning",
    "severity": "warning",
    "time": "2026-05-28T10:16:00+09:00",
    "lat": null,
    "lon": null,
    "title": "Strong Wind Advisory (継続) — Tokyo area",
    "titleJa": "強風注意報（継続）",
    "affects": [],
    "source": "jma",
    "url": "https://www.jma.go.jp/bosai/warning/#area_type=class20s&area_code=130000",
    "magnitude": null,
    "maxScale": null
  },
  {
    "id": "jma-130030-16",
    "type": "warning",
    "severity": "warning",
    "time": "2026-05-28T10:16:00+09:00",
    "lat": null,
    "lon": null,
    "title": "Wave Advisory (継続) — Tokyo area",
    "titleJa": "波浪注意報（継続）",
    "affects": [],
    "source": "jma",
    "url": "https://www.jma.go.jp/bosai/warning/#area_type=class20s&area_code=130000",
    "magnitude": null,
    "maxScale": null
  },
  {
    "id": "jma-130030-20",
    "type": "warning",
    "severity": "warning",
    "time": "2026-05-28T10:16:00+09:00",
    "lat": null,
    "lon": null,
    "title": "Dry Air Advisory (継続) — Tokyo area",
    "titleJa": "乾燥注意報（継続）",
    "affects": [],
    "source": "jma",
    "url": "https://www.jma.go.jp/bosai/warning/#area_type=class20s&area_code=130000",
    "magnitude": null,
    "maxScale": null
  },
  {
    "id": "jma-1336100-14",
    "type": "warning",
    "severity": "warning",
    "time": "2026-05-28T10:16:00+09:00",
    "lat": null,
    "lon": null,
    "title": "Thunderstorm Advisory (継続) — Tokyo area",
    "titleJa": "雷注意報（継続）",
    "affects": [],
    "source": "jma",
    "url": "https://www.jma.go.jp/bosai/warning/#area_type=class20s&area_code=130000",
    "magnitude": null,
    "maxScale": null
  },
  {
    "id": "jma-1336100-20",
    "type": "warning",
    "severity": "warning",
    "time": "2026-05-28T10:16:00+09:00",
    "lat": null,
    "lon": null,
    "title": "Dry Air Advisory (継続) — Tokyo area",
    "titleJa": "乾燥注意報（継続）",
    "affects": [],
    "source": "jma",
    "url": "https://www.jma.go.jp/bosai/warning/#area_type=class20s&area_code=130000",
    "magnitude": null,
    "maxScale": null
  },
  {
    "id": "jma-1336200-14",
    "type": "warning",
    "severity": "warning",
    "time": "2026-05-28T10:16:00+09:00",
    "lat": null,
    "lon": null,
    "title": "Thunderstorm Advisory (継続) — Tokyo area",
    "titleJa": "雷注意報（継続）",
    "affects": [],
    "source": "jma",
    "url": "https://www.jma.go.jp/bosai/warning/#area_type=class20s&area_code=130000",
    "magnitude": null,
    "maxScale": null
  },
  {
    "id": "jma-1336200-20",
    "type": "warning",
    "severity": "warning",
    "time": "2026-05-28T10:16:00+09:00",
    "lat": null,
    "lon": null,
    "title": "Dry Air Advisory (継続) — Tokyo area",
    "titleJa": "乾燥注意報（継続）",
    "affects": [],
    "source": "jma",
    "url": "https://www.jma.go.jp/bosai/warning/#area_type=class20s&area_code=130000",
    "magnitude": null,
    "maxScale": null
  },
  {
    "id": "jma-1336300-14",
    "type": "warning",
    "severity": "warning",
    "time": "2026-05-28T10:16:00+09:00",
    "lat": null,
    "lon": null,
    "title": "Thunderstorm Advisory (継続) — Tokyo area",
    "titleJa": "雷注意報（継続）",
    "affects": [],
    "source": "jma",
    "url": "https://www.jma.go.jp/bosai/warning/#area_type=class20s&area_code=130000",
    "magnitude": null,
    "maxScale": null
  },
  {
    "id": "jma-1336300-20",
    "type": "warning",
    "severity": "warning",
    "time": "2026-05-28T10:16:00+09:00",
    "lat": null,
    "lon": null,
    "title": "Dry Air Advisory (継続) — Tokyo area",
    "titleJa": "乾燥注意報（継続）",
    "affects": [],
    "source": "jma",
    "url": "https://www.jma.go.jp/bosai/warning/#area_type=class20s&area_code=130000",
    "magnitude": null,
    "maxScale": null
  },
  {
    "id": "jma-1336400-14",
    "type": "warning",
    "severity": "warning",
    "time": "2026-05-28T10:16:00+09:00",
    "lat": null,
    "lon": null,
    "title": "Thunderstorm Advisory (継続) — Tokyo area",
    "titleJa": "雷注意報（継続）",
    "affects": [],
    "source": "jma",
    "url": "https://www.jma.go.jp/bosai/warning/#area_type=class20s&area_code=130000",
    "magnitude": null,
    "maxScale": null
  },
  {
    "id": "jma-1336400-20",
    "type": "warning",
    "severity": "warning",
    "time": "2026-05-28T10:16:00+09:00",
    "lat": null,
    "lon": null,
    "title": "Dry Air Advisory (継続) — Tokyo area",
    "titleJa": "乾燥注意報（継続）",
    "affects": [],
    "source": "jma",
    "url": "https://www.jma.go.jp/bosai/warning/#area_type=class20s&area_code=130000",
    "magnitude": null,
    "maxScale": null
  },
  {
    "id": "jma-1338100-14",
    "type": "warning",
    "severity": "warning",
    "time": "2026-05-28T10:16:00+09:00",
    "lat": null,
    "lon": null,
    "title": "Thunderstorm Advisory (継続) — Tokyo area",
    "titleJa": "雷注意報（継続）",
    "affects": [],
    "source": "jma",
    "url": "https://www.jma.go.jp/bosai/warning/#area_type=class20s&area_code=130000",
    "magnitude": null,
    "maxScale": null
  },
  {
    "id": "jma-1338100-20",
    "type": "warning",
    "severity": "warning",
    "time": "2026-05-28T10:16:00+09:00",
    "lat": null,
    "lon": null,
    "title": "Dry Air Advisory (継続) — Tokyo area",
    "titleJa": "乾燥注意報（継続）",
    "affects": [],
    "source": "jma",
    "url": "https://www.jma.go.jp/bosai/warning/#area_type=class20s&area_code=130000",
    "magnitude": null,
    "maxScale": null
  },
  {
    "id": "jma-1338200-14",
    "type": "warning",
    "severity": "warning",
    "time": "2026-05-28T10:16:00+09:00",
    "lat": null,
    "lon": null,
    "title": "Thunderstorm Advisory (継続) — Tokyo area",
    "titleJa": "雷注意報（継続）",
    "affects": [],
    "source": "jma",
    "url": "https://www.jma.go.jp/bosai/warning/#area_type=class20s&area_code=130000",
    "magnitude": null,
    "maxScale": null
  },
  {
    "id": "jma-1338200-20",
    "type": "warning",
    "severity": "warning",
    "time": "2026-05-28T10:16:00+09:00",
    "lat": null,
    "lon": null,
    "title": "Dry Air Advisory (継続) — Tokyo area",
    "titleJa": "乾燥注意報（継続）",
    "affects": [],
    "source": "jma",
    "url": "https://www.jma.go.jp/bosai/warning/#area_type=class20s&area_code=130000",
    "magnitude": null,
    "maxScale": null
  },
  {
    "id": "jma-1340100-14",
    "type": "warning",
    "severity": "warning",
    "time": "2026-05-28T10:16:00+09:00",
    "lat": null,
    "lon": null,
    "title": "Thunderstorm Advisory (継続) — Tokyo area",
    "titleJa": "雷注意報（継続）",
    "affects": [],
    "source": "jma",
    "url": "https://www.jma.go.jp/bosai/warning/#area_type=class20s&area_code=130000",
    "magnitude": null,
    "maxScale": null
  },
  {
    "id": "jma-1340100-15",
    "type": "warning",
    "severity": "warning",
    "time": "2026-05-28T10:16:00+09:00",
    "lat": null,
    "lon": null,
    "title": "Strong Wind Advisory (継続) — Tokyo area",
    "titleJa": "強風注意報（継続）",
    "affects": [],
    "source": "jma",
    "url": "https://www.jma.go.jp/bosai/warning/#area_type=class20s&area_code=130000",
    "magnitude": null,
    "maxScale": null
  },
  {
    "id": "jma-1340100-16",
    "type": "warning",
    "severity": "warning",
    "time": "2026-05-28T10:16:00+09:00",
    "lat": null,
    "lon": null,
    "title": "Wave Advisory (継続) — Tokyo area",
    "titleJa": "波浪注意報（継続）",
    "affects": [],
    "source": "jma",
    "url": "https://www.jma.go.jp/bosai/warning/#area_type=class20s&area_code=130000",
    "magnitude": null,
    "maxScale": null
  },
  {
    "id": "jma-1340100-20",
    "type": "warning",
    "severity": "warning",
    "time": "2026-05-28T10:16:00+09:00",
    "lat": null,
    "lon": null,
    "title": "Dry Air Advisory (継続) — Tokyo area",
    "titleJa": "乾燥注意報（継続）",
    "affects": [],
    "source": "jma",
    "url": "https://www.jma.go.jp/bosai/warning/#area_type=class20s&area_code=130000",
    "magnitude": null,
    "maxScale": null
  },
  {
    "id": "jma-1340200-14",
    "type": "warning",
    "severity": "warning",
    "time": "2026-05-28T10:16:00+09:00",
    "lat": null,
    "lon": null,
    "title": "Thunderstorm Advisory (継続) — Tokyo area",
    "titleJa": "雷注意報（継続）",
    "affects": [],
    "source": "jma",
    "url": "https://www.jma.go.jp/bosai/warning/#area_type=class20s&area_code=130000",
    "magnitude": null,
    "maxScale": null
  },
  {
    "id": "jma-1340200-15",
    "type": "warning",
    "severity": "warning",
    "time": "2026-05-28T10:16:00+09:00",
    "lat": null,
    "lon": null,
    "title": "Strong Wind Advisory (継続) — Tokyo area",
    "titleJa": "強風注意報（継続）",
    "affects": [],
    "source": "jma",
    "url": "https://www.jma.go.jp/bosai/warning/#area_type=class20s&area_code=130000",
    "magnitude": null,
    "maxScale": null
  },
  {
    "id": "jma-1340200-16",
    "type": "warning",